{
  "site_id": "SYN-SITE-002",
  "site_name": "Synthetic Incomplete Candidate",
  "evaluation_date": "2026-07-01",
  "metrics": [
    {
      "metric_id": "demand_index",
      "raw_value": null,
      "unit": "index",
      "source_id": "SYNTHETIC",
      "observed_at": "2026-06-15",
      "geography": "market",
      "quality_status": "accepted",
      "sensitivity": "internal"
    }
  ],
  "qualitative_evidence": [],
  "constraints": []
}
